{
  "$schema": "https://json-schema.org/draft/2020-12/schema",
  "title": "Flashcard card, format_version 2",
  "description": "Enforced by tools/check_flashcard_json.py, which is the sole contract; this file is generated from its constants and expresses only what JSON Schema can state structurally. Passing this schema is necessary but NOT sufficient. Not expressed at all: G03 (word-count budgets on seven fields), G06 (exactly one bold row, must be last), G07 (aligned rows must be contiguous and run to the end), G09 (variable_key must cover every symbol in front.central), G10 (a back row may not use a symbol the front or an earlier row never introduced), G11 (no Unicode math glyphs in prose fields), G12 (balanced LaTeX braces), G14 (banned footer prefixes). Partially expressed: G08 (variable_key's shape and max entry count are checked here; its presence being tied to front.central's latex/text choice, symbol uniqueness, and the per-entry meaning word cap are not); G13 (the null-lo_ordinal branch is checked via source's if/then; the non-null branch, lo_ordinal range and lo_text matching the real corpus objective, needs a live references/*/book_map.json lookup a static schema cannot perform). A card can pass this schema and still be rejected by the validator.",
  "type": "object",
  "required": [
    "format_version",
    "card_type",
    "concept",
    "source",
    "front",
    "back"
  ],
  "properties": {
    "format_version": {
      "const": 2
    },
    "card_type": {
      "enum": [
        "concept_example",
        "problem_solution"
      ]
    },
    "concept": {
      "type": "string",
      "minLength": 1,
      "maxLength": 40
    },
    "source": {
      "type": "object",
      "required": [
        "book_tag",
        "section",
        "lo_ordinal",
        "lo_text"
      ],
      "properties": {
        "book_tag": {
          "type": "string"
        },
        "section": {
          "type": "string"
        },
        "lo_ordinal": {
          "type": [
            "integer",
            "null"
          ],
          "minimum": 1,
          "description": "The validator requires a true Python int (type(x) is int). This schema's 'integer' type also accepts a whole-number float such as 1.0, which the validator rejects; that divergence is not expressible here and is disclosed, not fixed."
        },
        "lo_text": {
          "type": "string"
        },
        "review_note": {
          "type": "string"
        }
      },
      "if": {
        "properties": {
          "lo_ordinal": {
            "const": null
          }
        }
      },
      "then": {
        "required": [
          "review_note"
        ],
        "properties": {
          "review_note": {
            "type": "string",
            "minLength": 1
          },
          "lo_text": {
            "maxLength": 0
          }
        }
      }
    },
    "front": {
      "type": "object",
      "required": [
        "title",
        "subtitle",
        "central",
        "main_description",
        "supporting_description",
        "footer"
      ],
      "properties": {
        "title": {
          "type": "string",
          "minLength": 1,
          "maxLength": 24
        },
        "subtitle": {
          "type": "string"
        },
        "central": {
          "type": "object",
          "oneOf": [
            {
              "required": [
                "latex"
              ]
            },
            {
              "required": [
                "text"
              ]
            }
          ],
          "properties": {
            "latex": {
              "type": "string"
            },
            "text": {
              "type": "string"
            }
          }
        },
        "variable_key": {
          "type": "array",
          "maxItems": 5,
          "items": {
            "type": "object",
            "required": [
              "symbol",
              "meaning"
            ],
            "properties": {
              "symbol": {
                "type": "string"
              },
              "meaning": {
                "type": "string"
              }
            }
          }
        },
        "main_description": {
          "type": "string"
        },
        "supporting_description": {
          "type": "string"
        },
        "footer": {
          "const": "Flip for a worked example"
        }
      }
    },
    "back": {
      "type": "object",
      "required": [
        "title",
        "problem",
        "rows",
        "footer"
      ],
      "properties": {
        "title": {
          "const": "Worked Example"
        },
        "problem": {
          "type": "array",
          "items": {
            "type": "object",
            "oneOf": [
              {
                "required": [
                  "t",
                  "v"
                ],
                "properties": {
                  "t": {
                    "const": "text"
                  },
                  "v": {
                    "type": "string"
                  }
                },
                "additionalProperties": false
              },
              {
                "required": [
                  "t",
                  "latex"
                ],
                "properties": {
                  "t": {
                    "const": "math"
                  },
                  "latex": {
                    "type": "string",
                    "minLength": 1
                  }
                },
                "additionalProperties": false
              }
            ]
          }
        },
        "rows": {
          "type": "array",
          "minItems": 4,
          "maxItems": 6,
          "items": {
            "type": "object",
            "required": [
              "segments",
              "aligned",
              "bold"
            ],
            "properties": {
              "segments": {
                "type": "array",
                "items": {
                  "type": "object",
                  "oneOf": [
                    {
                      "required": [
                        "t",
                        "v"
                      ],
                      "properties": {
                        "t": {
                          "const": "text"
                        },
                        "v": {
                          "type": "string"
                        }
                      },
                      "additionalProperties": false
                    },
                    {
                      "required": [
                        "t",
                        "latex"
                      ],
                      "properties": {
                        "t": {
                          "const": "math"
                        },
                        "latex": {
                          "type": "string",
                          "minLength": 1
                        }
                      },
                      "additionalProperties": false
                    }
                  ]
                },
                "minItems": 1
              },
              "aligned": {
                "type": "boolean"
              },
              "bold": {
                "type": "boolean"
              }
            }
          }
        },
        "footer": {
          "type": "string"
        }
      }
    }
  }
}
