{
  "format_version": 2,
  "card_type": "concept_example",
  "concept": "Definite Integral",
  "source": {
    "book_tag": "openstax_calc1",
    "section": "5.2",
    "lo_ordinal": 2,
    "lo_text": "Explain the terms integrand, limits of integration, and variable of integration."
  },
  "front": {
    "title": "Definite Integral",
    "subtitle": "Reading The Notation",
    "central": {
      "latex": "\\int_{a}^{b} f(x)\\,dx"
    },
    "variable_key": [
      {
        "symbol": "\\int_{a}^{b}",
        "meaning": "accumulate from a to b"
      },
      {
        "symbol": "a",
        "meaning": "lower limit of integration"
      },
      {
        "symbol": "b",
        "meaning": "upper limit of integration"
      },
      {
        "symbol": "f(x)",
        "meaning": "the integrand being accumulated"
      },
      {
        "symbol": "dx",
        "meaning": "variable of integration"
      }
    ],
    "main_description": "Every part of this symbol names one piece of the setup.",
    "supporting_description": "Reading it correctly tells you what accumulates and over which interval.",
    "footer": "Flip for a worked example"
  },
  "back": {
    "title": "Worked Example",
    "problem": [
      {
        "t": "text",
        "v": "Name each part of "
      },
      {
        "t": "math",
        "latex": "\\int_{1}^{4} 3x^{2}\\,dx"
      }
    ],
    "rows": [
      {
        "segments": [
          {
            "t": "text",
            "v": "The integrand is"
          },
          {
            "t": "math",
            "latex": "3x^{2}"
          }
        ],
        "aligned": false,
        "bold": false
      },
      {
        "segments": [
          {
            "t": "text",
            "v": "The limits of integration are"
          },
          {
            "t": "math",
            "latex": "a=1"
          },
          {
            "t": "text",
            "v": "and"
          },
          {
            "t": "math",
            "latex": "b=4"
          }
        ],
        "aligned": false,
        "bold": false
      },
      {
        "segments": [
          {
            "t": "text",
            "v": "The variable of integration is"
          },
          {
            "t": "math",
            "latex": "x"
          }
        ],
        "aligned": false,
        "bold": false
      },
      {
        "segments": [
          {
            "t": "text",
            "v": "So this accumulates"
          },
          {
            "t": "math",
            "latex": "3x^{2}"
          },
          {
            "t": "text",
            "v": "from 1 to 4."
          }
        ],
        "aligned": false,
        "bold": true
      }
    ],
    "footer": "The limits say where, the integrand says what."
  }
}
