{
  "format_version": 2,
  "card_type": "concept_example",
  "concept": "Power Rule",
  "source": {
    "book_tag": "openstax_calc1",
    "section": "3.3",
    "lo_ordinal": 1,
    "lo_text": "State the constant, constant multiple, and power rules."
  },
  "front": {
    "title": "Power Rule",
    "subtitle": "Differentiate Powers",
    "central": {
      "latex": "\\frac{d}{dx}\\left(x^{n}\\right)=nx^{n-1}"
    },
    "variable_key": [
      {
        "symbol": "\\frac{d}{dx}",
        "meaning": "rate of change with respect to x"
      },
      {
        "symbol": "n",
        "meaning": "constant exponent"
      },
      {
        "symbol": "x",
        "meaning": "variable you differentiate by"
      }
    ],
    "main_description": "Differentiate any power of a variable in one step.",
    "supporting_description": "Multiply by the old exponent, then lower that exponent by one.",
    "footer": "Flip for a worked example"
  },
  "back": {
    "title": "Worked Example",
    "problem": [
      {
        "t": "text",
        "v": "Differentiate "
      },
      {
        "t": "math",
        "latex": "f(x)=x^{5}"
      }
    ],
    "rows": [
      {
        "segments": [
          {
            "t": "text",
            "v": "Here"
          },
          {
            "t": "math",
            "latex": "n=5"
          }
        ],
        "aligned": false,
        "bold": false
      },
      {
        "segments": [
          {
            "t": "math",
            "latex": "\\frac{d}{dx}\\left(x^{n}\\right)=nx^{n-1}"
          }
        ],
        "aligned": false,
        "bold": false
      },
      {
        "segments": [
          {
            "t": "math",
            "latex": "f'(x)=5x^{5-1}"
          }
        ],
        "aligned": true,
        "bold": false
      },
      {
        "segments": [
          {
            "t": "math",
            "latex": "f'(x)=5x^{4}"
          }
        ],
        "aligned": true,
        "bold": true
      }
    ],
    "footer": "Power down front, exponent down one."
  }
}
